{
  "schema_version": "1.0.0",
  "run_id": "e03-release-drift-1m-x3",
  "engine": "common",
  "started_at": "2026-08-10T08:16:32.501Z",
  "source_revision": "working-tree",
  "build_type": "release",
  "clock_domains": [
    "monotonic",
    "unity_dsp",
    "godot_audio"
  ],
  "inputs": [
    {
      "path": "shared/fixtures/test-pack/click.wav",
      "sha256": "f12f33e98f7431539c8790502f5fdfb6e8763883707605243cf5c60aeaacd79a"
    },
    {
      "path": "artifacts/raw/e03-release-drift/unity/trial-1.jsonl",
      "sha256": "14ae21e027f85ebb6d1afea8568509bfbab63ad5c2c461e38c3cb36cb7cec792"
    },
    {
      "path": "artifacts/raw/e03-release-drift/unity/trial-2.jsonl",
      "sha256": "cdbfffe0ec4cf3cf72c43fbcd6f7d720b8f7dd7cc7f1e189867b6b5c0a59327a"
    },
    {
      "path": "artifacts/raw/e03-release-drift/unity/trial-3.jsonl",
      "sha256": "cdbfffe0ec4cf3cf72c43fbcd6f7d720b8f7dd7cc7f1e189867b6b5c0a59327a"
    },
    {
      "path": "artifacts/raw/e03-release-drift/godot/trial-1.jsonl",
      "sha256": "e44efd8f507c8f14aaf17c8cf7985d24531a31073048d704076306d51d693d87"
    },
    {
      "path": "artifacts/raw/e03-release-drift/godot/trial-2.jsonl",
      "sha256": "6558d21cf52526ba54e4cc9c2f516e9d5d2c7d358d8f0f075dba536fe9f21dab"
    },
    {
      "path": "artifacts/raw/e03-release-drift/godot/trial-3.jsonl",
      "sha256": "2768d72bb74f72ba1b41173084242871582c17c6e5dff57f51428b908c75bfc0"
    }
  ],
  "outputs": [
    {
      "path": "artifacts/raw/e03-release-drift/summary.json",
      "sha256": "868d87ca13e834a1970fd58149b9fa2a15585acd4970a6cbc0ea9ff4197a6deb"
    }
  ]
}
