{
  "schema_version": "1.0.0",
  "run_id": "e02-real-device-comparison",
  "engine": "common",
  "started_at": "2026-08-10T07:59:32.202Z",
  "source_revision": "working-tree",
  "build_type": "release",
  "clock_domains": [
    "monotonic",
    "core_midi_host_time"
  ],
  "inputs": [
    {
      "path": "shared/fixtures/instrument-profiles/roland-mn10-handpan-minor-v1.json",
      "sha256": "ae0d853db4b1974788c6ffe645fc652110e374eb04fea5ab397adfe6103440f9"
    },
    {
      "path": "artifacts/raw/e02-real-device/unity/session-1.jsonl",
      "sha256": "01bec3d3f001ade1579cd96b6df977630f4217b740bdd683ff773633d8bc03e9"
    },
    {
      "path": "artifacts/raw/e02-real-device/unity/session-2.jsonl",
      "sha256": "da8a8baeb9fdc1019e335e1dd362c10be976d24a7df01093e50fdbe81e949d03"
    },
    {
      "path": "artifacts/raw/e02-real-device/unity/session-3.jsonl",
      "sha256": "49468c5172f43274c3fae48025272edcb52e91847dd68840c988d214f7dddf87"
    },
    {
      "path": "artifacts/raw/e02-real-device/godot/session-1.jsonl",
      "sha256": "30edad63d154791b1cd20d8f7f577793aa4f3a7fec471dd0693d5e067f971329"
    },
    {
      "path": "artifacts/raw/e02-real-device/godot/session-2.jsonl",
      "sha256": "5e7b5a7d186b2f950a4402874b76ec6bb344580c51323057eb06d0a61c774f39"
    },
    {
      "path": "artifacts/raw/e02-real-device/godot/session-3.jsonl",
      "sha256": "1969d91c05247f8125f78e5086e74832db68de529d697cf7f5ecf8459234d155"
    }
  ],
  "outputs": [
    {
      "path": "artifacts/raw/e02-real-device/summary.json",
      "sha256": "c95d7ecf0477bdb54e355c175b15664d53b8b4405682ba311ae72bd25811fda2"
    }
  ]
}
