{"schema_version":"1.0.0","run_id":"f03-validation","engine":"common","started_at":"2026-08-09T12:00:00+09:00","source_revision":"working-tree","build_type":"tool","clock_domains":["synthetic","song_time"],"inputs":[{"path":"shared/fixtures/schema-valid/chart.json","sha256":"0000000000000000000000000000000000000000000000000000000000000000"}],"outputs":[]}
