{
  "schema_version": "1.0.0",
  "run_id": "e01-automated-comparison",
  "engine": "common",
  "started_at": "2026-08-10T07:26:49.155Z",
  "source_revision": "working-tree",
  "build_type": "release",
  "clock_domains": [
    "song_time",
    "monotonic",
    "unity_dsp",
    "godot_audio"
  ],
  "inputs": [
    {
      "path": "artifacts/raw/unity-u06/run-manifest.json",
      "sha256": "54dc26003ed815584bedb5da2c9a5b8b30e86ab4ec37c30bc360cd12b9088553"
    },
    {
      "path": "artifacts/raw/godot-g06/run-manifest.json",
      "sha256": "4a3e460f6bdeffd952a73b24a31129527fe38119f978de2f02d728ce0b6b0561"
    },
    {
      "path": "shared/fixtures/test-pack/chart.json",
      "sha256": "825e2256754862a0132ada43aacd21d72ba9bb722d4c3c3079e45a09c264ba07"
    },
    {
      "path": "artifacts/raw/e01-comparison/trials/unity/trial-1.json",
      "sha256": "2f57f50d2d049cb933916034de195d6f829192a33335b37bd27c17d3b4a671dd"
    },
    {
      "path": "artifacts/raw/e01-comparison/trials/unity/trial-2.json",
      "sha256": "2f57f50d2d049cb933916034de195d6f829192a33335b37bd27c17d3b4a671dd"
    },
    {
      "path": "artifacts/raw/e01-comparison/trials/unity/trial-3.json",
      "sha256": "2f57f50d2d049cb933916034de195d6f829192a33335b37bd27c17d3b4a671dd"
    },
    {
      "path": "artifacts/raw/e01-comparison/trials/godot/trial-1.json",
      "sha256": "e775ea79725e76cade6f961b9dc07aa1c2a5430aa3f2c92b778a1dada4ddfef4"
    },
    {
      "path": "artifacts/raw/e01-comparison/trials/godot/trial-2.json",
      "sha256": "e775ea79725e76cade6f961b9dc07aa1c2a5430aa3f2c92b778a1dada4ddfef4"
    },
    {
      "path": "artifacts/raw/e01-comparison/trials/godot/trial-3.json",
      "sha256": "e775ea79725e76cade6f961b9dc07aa1c2a5430aa3f2c92b778a1dada4ddfef4"
    },
    {
      "path": "artifacts/raw/e01-comparison/build-times.tsv",
      "sha256": "b51a50b0dc9ebd6a1fd2fac0342f990b4f5a0863bf74aa2105e046a490288762"
    }
  ],
  "outputs": [
    {
      "path": "artifacts/raw/e01-comparison/comparison.json",
      "sha256": "f0886b856c490b6abcf3de9fd2ffb0f2e112764abdee7d8f7b74019d7fe2a15f"
    },
    {
      "path": "artifacts/reports/e01-comparison/same-time-side-by-side.png",
      "sha256": "b76815ae7a89718d87ccdf45b381dba93c1e5a8c1b313240fc71ec4ac7ee4524"
    }
  ]
}
